{
  "specVersion": "1.0",
  "id": "reconnect-recovery",
  "language": "en-US",
  "startedAt": "2026-08-01T00:00:00.000Z",
  "metadata": {
    "scenario": "network-recovery",
    "expected": "pass"
  },
  "events": [
    {
      "at": 0,
      "type": "consent.granted"
    },
    {
      "at": 10,
      "type": "connection.opened"
    },
    {
      "at": 100,
      "type": "capture.audio.start"
    },
    {
      "at": 1000,
      "type": "connection.error",
      "message": "network reset"
    },
    {
      "at": 2200,
      "type": "connection.opened"
    },
    {
      "at": 2500,
      "type": "user.speech.start"
    },
    {
      "at": 3200,
      "type": "user.speech.end",
      "turnId": "u1"
    },
    {
      "at": 3600,
      "type": "agent.response.start",
      "turnId": "a1",
      "inReplyTo": "u1"
    },
    {
      "at": 4000,
      "type": "agent.response.end",
      "turnId": "a1",
      "text": "Connection restored."
    }
  ]
}
