{
  "specVersion": "1.0",
  "id": "happy-path-en",
  "language": "en-US",
  "startedAt": "2026-08-01T00:00:00.000Z",
  "metadata": {
    "scenario": "booking",
    "expected": "pass"
  },
  "events": [
    {
      "at": 0,
      "type": "consent.granted"
    },
    {
      "at": 20,
      "type": "connection.opened"
    },
    {
      "at": 100,
      "type": "capture.audio.start"
    },
    {
      "at": 500,
      "type": "user.speech.start"
    },
    {
      "at": 1800,
      "type": "user.speech.end",
      "turnId": "u1"
    },
    {
      "at": 2180,
      "type": "agent.response.start",
      "turnId": "a1",
      "inReplyTo": "u1"
    },
    {
      "at": 2800,
      "type": "tool.call",
      "callId": "c1",
      "name": "check_availability"
    },
    {
      "at": 3100,
      "type": "tool.result",
      "callId": "c1",
      "ok": true
    },
    {
      "at": 3500,
      "type": "agent.response.end",
      "turnId": "a1",
      "text": "Tuesday at 10:00 is available."
    },
    {
      "at": 4000,
      "type": "user.interruption"
    },
    {
      "at": 4250,
      "type": "agent.response.stop",
      "turnId": "a1"
    },
    {
      "at": 5000,
      "type": "capture.audio.stop"
    },
    {
      "at": 5100,
      "type": "consent.revoked"
    }
  ]
}
